{
  "schema_version": 1,
  "tenant_id": "dev",
  "strategy_id": "copytrade-v1",
  "event_id": "0193b300-0003-7c2b-9c9e-3b5fbe7c3a12",
  "occurred_at": "2026-05-13T17:23:02Z",
  "kind": "EntryExpired",
  "subject": {
    "signal_id": "111222333:0",
    "intent_key": "t-dev/s-copytrade-v1/sig/111222333:0:entry",
    "broker_order_id": "stub-t-dev/s-copytrade-v1/sig/111222333:0:entry",
    "ttl_secs": 90,
    "outcome": "EXPIRED"
  },
  "actor": "workflow:CopytradeSignalWorkflow",
  "workflow_id": "t-dev/s-copytrade-v1/sig/111222333:0",
  "correlation_id": "111222333:0"
}
